[{"batch_id":"art-batch:museum-03b-first-slate-v1","data_version":"1.0.0","disposition":"out_of_scope","entity_type":"relationship_research_disposition","evidence_gaps":[],"formal_relationship_id":null,"id":"relationship-disposition:inherited-06913aeb-04f7-58f7-a7f0-5edc2901c11a","lead_id":"relationship-lead:06913aeb-04f7-58f7-a7f0-5edc2901c11a","origin_kind":"inherited_lead","phase_id":"MUSEUM-03B","rationale":"At least one endpoint is outside the user-approved 12-person slate. Endpoint identifiers and names are intentionally omitted from this privacy-safe tracked closure.","research_candidate_id":null,"review_signoff_id":"review-signoff:museum-03b-relationship-dispositions","reviewed_at":"2026-07-13T14:21:00+08:00","reviewed_by":"codex-primary-agent","schema_version":"1.0.0","superseded_by_lead_id":null},{"batch_id":"art-batch:museum-03b-first-slate-v1","data_version":"1.0.0","disposition":"out_of_scope","entity_type":"relationship_research_disposition","evidence_gaps":[],"formal_relationship_id":null,"id":"relationship-disposition:inherited-0827911e-bedd-5642-97b1-b2daf34bee8b","lead_id":"relationship-lead:0827911e-bedd-5642-97b1-b2daf34bee8b","origin_kind":"inherited_lead","phase_id":"MUSEUM-03B","rationale":"At least one endpoint is outside the user-approved 12-person slate. Endpoint identifiers and names are intentionally omitted from this privacy-safe tracked closure.","research_candidate_id":null,"review_signoff_id":"review-signoff:museum-03b-relationship-dispositions","reviewed_at":"2026-07-13T14:21:00+08:00","reviewed_by":"codex-primary-agent","schema_version":"1.0.0","superseded_by_lead_id":null},{"batch_id":"art-batch:museum-03b-first-slate-v1","data_version":"1.0.0","disposition":"out_of_scope","entity_type":"relationship_research_disposition","evidence_gaps":[],"formal_relationship_id":null,"id":"relationship-disposition:inherited-0f572f83-4473-550f-a5e6-f157bdde2cef","lead_id":"relationship-lead:0f572f83-4473-550f-a5e6-f157bdde2cef","origin_kind":"inherited_lead","phase_id":"MUSEUM-03B","rationale":"At least one endpoint is outside the user-approved 12-person slate. Endpoint identifiers and names are intentionally omitted from this privacy-safe tracked closure.","research_candidate_id":null,"review_signoff_id":"review-signoff:museum-03b-relationship-dispositions","reviewed_at":"2026-07-13T14:21:00+08:00","reviewed_by":"codex-primary-agent","schema_version":"1.0.0","superseded_by_lead_id":null},{"batch_id":"art-batch:museum-03b-first-slate-v1","data_version":"1.0.0","disposition":"out_of_scope","entity_type":"relationship_research_disposition","evidence_gaps":[],"formal_relationship_id":null,"id":"relationship-disposition:inherited-1231018a-d6a4-5bbf-ad03-d6a5b6a8de00","lead_id":"relationship-lead:1231018a-d6a4-5bbf-ad03-d6a5b6a8de00","origin_kind":"inherited_lead","phase_id":"MUSEUM-03B","rationale":"At least one endpoint is outside the user-approved 12-person slate. Endpoint identifiers and names are intentionally omitted from this privacy-safe tracked closure.","research_candidate_id":null,"review_signoff_id":"review-signoff:museum-03b-relationship-dispositions","reviewed_at":"2026-07-13T14:21:00+08:00","reviewed_by":"codex-primary-agent","schema_version":"1.0.0","superseded_by_lead_id":null},{"batch_id":"art-batch:museum-03b-first-slate-v1","data_version":"1.0.0","disposition":"superseded","entity_type":"relationship_research_disposition","evidence_gaps":[],"formal_relationship_id":null,"id":"relationship-disposition:inherited-12de7ab3-eac9-59f4-97ff-696fe45d6448","lead_id":"relationship-lead:12de7ab3-eac9-59f4-97ff-696fe45d6448","origin_kind":"inherited_lead","phase_id":"MUSEUM-03B","rationale":"This inherited unsupported scholarly-comparison lead duplicates the approved endpoint pair already closed by a narrower exact material comparison.","research_candidate_id":null,"review_signoff_id":"review-signoff:museum-03b-relationship-dispositions","reviewed_at":"2026-07-13T14:21:00+08:00","reviewed_by":"codex-primary-agent","schema_version":"1.0.0","superseded_by_lead_id":"relationship-lead:217d5837-e7d2-5540-8abc-1fe42cdfc54b"},{"batch_id":"art-batch:museum-03b-first-slate-v1","data_version":"1.0.0","disposition":"out_of_scope","entity_type":"relationship_research_disposition","evidence_gaps":[],"formal_relationship_id":null,"id":"relationship-disposition:inherited-1adf0e93-6706-50b3-a889-0e39984c9f11","lead_id":"relationship-lead:1adf0e93-6706-50b3-a889-0e39984c9f11","origin_kind":"inherited_lead","phase_id":"MUSEUM-03B","rationale":"At least one endpoint is outside the user-approved 12-person slate. Endpoint identifiers and names are intentionally omitted from this privacy-safe tracked closure.","research_candidate_id":null,"review_signoff_id":"review-signoff:museum-03b-relationship-dispositions","reviewed_at":"2026-07-13T14:21:00+08:00","reviewed_by":"codex-primary-agent","schema_version":"1.0.0","superseded_by_lead_id":null},{"batch_id":"art-batch:museum-03b-first-slate-v1","data_version":"1.0.0","disposition":"out_of_scope","entity_type":"relationship_research_disposition","evidence_gaps":[],"formal_relationship_id":null,"id":"relationship-disposition:inherited-1c9e9aaf-a2b4-53cb-bb1f-84607aca84d9","lead_id":"relationship-lead:1c9e9aaf-a2b4-53cb-bb1f-84607aca84d9","origin_kind":"inherited_lead","phase_id":"MUSEUM-03B","rationale":"At least one endpoint is outside the user-approved 12-person slate. Endpoint identifiers and names are intentionally omitted from this privacy-safe tracked closure.","research_candidate_id":null,"review_signoff_id":"review-signoff:museum-03b-relationship-dispositions","reviewed_at":"2026-07-13T14:21:00+08:00","reviewed_by":"codex-primary-agent","schema_version":"1.0.0","superseded_by_lead_id":null},{"batch_id":"art-batch:museum-03b-first-slate-v1","data_version":"1.0.0","disposition":"promoted_to_formal_relationship","entity_type":"relationship_research_disposition","evidence_gaps":[],"formal_relationship_id":"art-rel:m03b-001","id":"relationship-disposition:inherited-217d5837-e7d2-5540-8abc-1fe42cdfc54b","lead_id":"relationship-lead:217d5837-e7d2-5540-8abc-1fe42cdfc54b","origin_kind":"inherited_lead","phase_id":"MUSEUM-03B","rationale":"Promoted after exact selected objects 436533 and 111442 closed the shared oil-and-canvas material evidence.","research_candidate_id":null,"review_signoff_id":"review-signoff:museum-03b-relationship-dispositions","reviewed_at":"2026-07-13T14:21:00+08:00","reviewed_by":"codex-primary-agent","schema_version":"1.0.0","superseded_by_lead_id":null},{"batch_id":"art-batch:museum-03b-first-slate-v1","data_version":"1.0.0","disposition":"out_of_scope","entity_type":"relationship_research_disposition","evidence_gaps":[],"formal_relationship_id":null,"id":"relationship-disposition:inherited-221b16ed-c476-5786-9015-26d23744a2ad","lead_id":"relationship-lead:221b16ed-c476-5786-9015-26d23744a2ad","origin_kind":"inherited_lead","phase_id":"MUSEUM-03B","rationale":"At least one endpoint is outside the user-approved 12-person slate. Endpoint identifiers and names are intentionally omitted from this privacy-safe tracked closure.","research_candidate_id":null,"review_signoff_id":"review-signoff:museum-03b-relationship-dispositions","reviewed_at":"2026-07-13T14:21:00+08:00","reviewed_by":"codex-primary-agent","schema_version":"1.0.0","superseded_by_lead_id":null},{"batch_id":"art-batch:museum-03b-first-slate-v1","data_version":"1.0.0","disposition":"superseded","entity_type":"relationship_research_disposition","evidence_gaps":[],"formal_relationship_id":null,"id":"relationship-disposition:inherited-2383fcef-8cf2-5207-9982-aa11de45ea3e","lead_id":"relationship-lead:2383fcef-8cf2-5207-9982-aa11de45ea3e","origin_kind":"inherited_lead","phase_id":"MUSEUM-03B","rationale":"This inherited unsupported scholarly-comparison lead duplicates the approved endpoint pair already closed by exact woodblock-technique evidence.","research_candidate_id":null,"review_signoff_id":"review-signoff:museum-03b-relationship-dispositions","reviewed_at":"2026-07-13T14:21:00+08:00","reviewed_by":"codex-primary-agent","schema_version":"1.0.0","superseded_by_lead_id":"relationship-lead:bda32b8b-c7f6-5fcf-a49d-6a3ef370e95d"},{"batch_id":"art-batch:museum-03b-first-slate-v1","data_version":"1.0.0","disposition":"promoted_to_formal_relationship","entity_type":"relationship_research_disposition","evidence_gaps":[],"formal_relationship_id":"art-rel:m03b-011","id":"relationship-disposition:inherited-25fdb3ac-e39b-5db5-a965-53fb4bbc5a02","lead_id":"relationship-lead:25fdb3ac-e39b-5db5-a965-53fb4bbc5a02","origin_kind":"inherited_lead","phase_id":"MUSEUM-03B","rationale":"Reclassified from unsupported scholarly comparison to printmaking using exact selected objects 851484 and 717597; the posthumous collection association remains explicit.","research_candidate_id":null,"review_signoff_id":"review-signoff:museum-03b-relationship-dispositions","reviewed_at":"2026-07-13T14:21:00+08:00","reviewed_by":"codex-primary-agent","schema_version":"1.0.0","superseded_by_lead_id":null},{"batch_id":"art-batch:museum-03b-first-slate-v1","data_version":"1.0.0","disposition":"out_of_scope","entity_type":"relationship_research_disposition","evidence_gaps":[],"formal_relationship_id":null,"id":"relationship-disposition:inherited-2d0e4ae7-8c0f-5449-b581-c10806629bd5","lead_id":"relationship-lead:2d0e4ae7-8c0f-5449-b581-c10806629bd5","origin_kind":"inherited_lead","phase_id":"MUSEUM-03B","rationale":"At least one endpoint is outside the user-approved 12-person slate. Endpoint identifiers and names are intentionally omitted from this privacy-safe tracked closure.","research_candidate_id":null,"review_signoff_id":"review-signoff:museum-03b-relationship-dispositions","reviewed_at":"2026-07-13T14:21:00+08:00","reviewed_by":"codex-primary-agent","schema_version":"1.0.0","superseded_by_lead_id":null},{"batch_id":"art-batch:museum-03b-first-slate-v1","data_version":"1.0.0","disposition":"out_of_scope","entity_type":"re